{
  "memory_id": "mem-equiv-B",
  "memory_type": "foundation",
  "content": {
    "text": "The user has a golden retriever as their dog."
  },
  "source": {
    "source_type": "phase2_umr",
    "reference_id": "locomo-umr-0201"
  },
  "parent_ids": [],
  "creation_event": "evt-created-mem-equiv-B",
  "creation_timestamp": "2026-06-02T00:00:00Z",
  "lifecycle_state": "ACTIVE",
  "equivalent_to": ["mem-equiv-A"]
}
