{
  "memory_id": "mem-pref-tea",
  "memory_type": "foundation",
  "content": {
    "text": "User prefers tea."
  },
  "source": {
    "source_type": "phase2_umr",
    "reference_id": "locomo-umr-0100"
  },
  "parent_ids": [],
  "creation_event": "evt-created-mem-pref-tea",
  "creation_timestamp": "2026-06-01T00:00:00Z",
  "lifecycle_state": "RETIRED",
  "conflicts_with": ["mem-pref-coffee"],
  "superseded_by": "mem-pref-coffee"
}
