{
  "memory_id": "mem-equiv-A",
  "memory_type": "foundation",
  "content": {
    "text": "User's dog is a golden retriever."
  },
  "source": {
    "source_type": "phase2_umr",
    "reference_id": "locomo-umr-0200"
  },
  "parent_ids": [],
  "creation_event": "evt-created-mem-equiv-A",
  "creation_timestamp": "2026-06-01T00:00:00Z",
  "lifecycle_state": "ACTIVE",
  "equivalent_to": ["mem-equiv-B"]
}
